<!DOCTYPE books [
  <!ELEMENT books (book+)>
  <!ELEMENT book (title, author, publisher, year, price)>
  <!ATTLIST book
    id CDATA #REQUIRED>
  <!ELEMENT title (#PCDATA)>
  <!ELEMENT author (#PCDATA)>
  <!ELEMENT publisher (#PCDATA)>
  <!ELEMENT year (#PCDATA)>
  <!ELEMENT price (#PCDATA)>
]>